{"$schema":"https://json-schema.org/draft/2020-12/schema","type":"object","required":["schemaVersion","id","name","version","protocol","kind","executable","permissions"],"properties":{"schemaVersion":{"const":"mathos-plugin-v1"},"id":{"type":"string"},"name":{"type":"string"},"version":{"type":"string"},"protocol":{"const":"json-rpc-2.0-stdio"},"kind":{"enum":["PROVER","SOLVER","LITERATURE_PROVIDER","RETRIEVER","EXPORTER","VISUALIZER"]},"executable":{"type":"string"},"permissions":{"type":"object"}},"additionalProperties":true}
